I consider there to be a man in that garden.,1
They alleged there to have been many strangers in that garden.,1
John wagered there to have been a stranger in that haunted house.,1
John tried to kiss Mary.,1
John persuaded Mary to kiss him.,1
John told Mary to kiss him.,1
It is illegal to park here.,1
I remembered him having kissed Mary.,1
I reported him having kissed Mary.,1
I reported having kissed Mary.,1
I enjoy taking a bath.,1
I detest taking a bath.,1
I saw him kissing Mary.,1
I noticed him kissing Mary.,1
John's refusing the offer is shocking.,1
the enemy's destroying the city was horrific.,1
John's refusal of the offer was shocking.,1
the enemy's destruction of the city was horrific.,1
I often send Mary home drunk and she gets there just fine.,1
I don't think Fred will either.,1
Jos likes cabbage and Holly does too.,1
Jos ate cabbage and Holly has too.,1
Jos is eating cabbage and Holly is too.,1
John is leaving but Mary's not.,1
I consider Bill intelligent and I consider Sally not.,1
John wants to go on vacation but he doesn't know when to.,1
Sally might have eaten cabbage but Holly shouldn't.,1
Jos asks that we go to the meeting and Sally will tell us when.,1
It's to Mary that Joe said Holly can talk.,1
Mary claimed that eaten cabbage Holly hasn't.,1
Mary claimed that eating cabbage Holly's not.,1
Mary claimed that eat cabbage Holly wants to.,1
John didn't hit a home run but I know a woman who did.,1
That Betsy won the batting crown is not surprising but that Peter didn't know she did is surprising.,1
Lilly decided that eating cabbage she should be.,1
Read Fred's story I also want to.,1
Mag Wildwood came to introduce the bartender but I came not to.,1
Mag Wildwood came to introduce the bartender but I came precisely not to.,1
You should unload rifles because not to s is dangerous.,1
If Ron knows whether to wear a tuxedo and Caspar knows whether not to do they know different things?,1
Lucy recounted a story to remember because Holly had recounted as story not to.,1
Did Harry leave?,1
Does Joe sing?,1
Every man who said he would buy some salmon did.,1
I visited every town I had to.,1
Every town in every country I had to I visited.,1
Every man who said he would buy some salmon did buy some salmon.,1
Lilly should buy salmon and Mary should too.,1
Lilly should buy salmon and Mary should buy salmon too.,1
Joe's neuroses bother his patrons and Sally's neuroses do too.,1
Joe likes his bar and Sally's patrons do too.,1
Every picture of itself arrived.,1
My uncle doesn't have a spouse but your aunt does and he is lying on the floor.,1
I know which book Max read and which book Oscar didn't.,1
This is the book of which Bill approves and this is the one of which he doesn't.,1
Dulles suspected everyone who Angleton did.,1
While Bob read Fred he didn't Dickens.,1
Sally suspected Joe but he didn't Holly.,1
Sally will stand near every woman that you will.,1
I know which woman Holly will discuss a report about but I don't know which woman you will.,1
While Truman didn't visit me he did you.,1
While Truman didn't tell me a story he did Rusty.,1
While Jos won't talk about Mag he might about Holly.,1
Although Doc might tell it to you he won't to me.,1
I think you need to show yourself more than you do anyone else.,1
While Truman doesn't want to visit every city he does Barcelona.,1
Fred likes eggplants although he likes cabbage too.,1
Although he likes cabbage too Fred likes eggplants.,1
Fred gave flowers to his sweetie because Frank had.,1
China is a country that Joe wants to visit and he will too if he gets enough money.,1
Jerry wouldn't read a book by Babel but Meryl has done so and it was pretty good.,1
Joe might wish he had but this isn't a country he has visited.,1
While I might want to this is the kind of thing that Harris has already suggested.,1
We like our friends and they do too.,1
We like our friends and they like our friends too.,1
We like our friends and they like their friends too.,1
Rusty talked about himself only after Holly did.,1
I could find no solution but Holly might.,1
Fred talked about everything before Rusty did.,1
Joe will go to the store even though Fred already has.,1
Today there is little or no official harassment of lesbians and gays by the national government although autonomous governments might.,1
The candidate was dogged by charges of infidelity and avoiding the draft or at least trying to.,1
This information could have been released by Gorbachev but he chose not to.,1
A lot of this material can be presented in a fairly informal and accessible fashion and often I do.,1
John does not like Mary.,1
John tries to often meet Mary.,1
John tries not to meet Mary.,1
Is Mary running the marathon?,1
Mary is often running the marathon.,1
Mary is not running the marathon.,1
I didn't as Bill had thought go to the store.,1
I did as Bill had thought go to the store.,1
The writers could so believe the boy.,1
The writers did so believe the boy.,1
Rome destroyed Carthage.,1
Rome's destruction of Carthage was horrific.,1
John bought the picture of himself that Bill saw.,1
The perception of the problem is quite thorough.,1
The knowledge of the problem is quite thorough.,1
The sinking of the ship was very devious.,1
The sinking of the ship to collect the insurance was very devious.,1
The ship's sinking was very devious.,1
The testing of such drugs on oneself is too risky.,1
The ship was sunk to collect the insurance.,1
This drug must first be tested on oneself.,1
The president's moral destruction is complete.,1
The moral destruction of the president was certainly not helpful.,1
Mary wants to wear nice blue German dress.,1
Tomatoes were introduced in Europe after 492.,1
We rich have impeccable taste.,1
I read his every book.,1
Every boy named a planet.,1
I showed every boy a planet.,1
Few boys read any of the books.,1
I showed few boys any of the books.,1
I was not reading a book when you came in.,1
A boy did not laugh.,1
Most boys did not laugh.,1
Every boy named Mercury and Venus.,1
Every boy named every planet.,1
Each student speaks two languages.,1
Two students speak each language.,1
Some tourists visited all the museums.,1
Fond of some boy every girl is.,1
A critic thinks that every book is readable.,1
Who does he admire?,1
He admires every man.,1
Who admires what?,1
Someone from every city hates it.,1
Some professor admires every student.,1
Some professor admires every student and hates the dean.,1
Everyone reported that Max and some lady disappeared.,1
Most guests will be offended if we don't invite some philosopher.,1
All students believe anything that many teachers say.,1
Who will be offended if we don't invite which philosopher?,1
Who believes anything that who says?,1
Exactly two boys kissed some girl.,1
Mary dates exactly two of the men who know a producer I like.,1
Every student has to come up with three arguments that show that some condition proposed by Bill is wrong.,1
If we invite some philosopher Max will be offended.,1
Three relatives of mine inherited a house.,1
If three relatives of mine die I will inherit a house.,1
Everyone attended some seminar.,1
Exactly half of the students attended some seminar.,1
More than three students attended every seminar.,1
Every student attended more than three seminars.,1
Every man lifted the table.,1
The men surrounded the fort.,1
All the men surrounded the fort.,1
The men lifted the table together.,1
A hundred men lifted the table together.,1
All the men lifted the table together.,1
Every man lifted a table.,1
Each man lifted a table.,1
Someone attended every seminar.,1
More than two students attended every seminar.,1
You married no one.,1
I will force you to marry no one.,1
Everyone had been worrying himself stiff.,1
Everyone who had been worrying himself stiff said that he was relieved.,1
There were five tourists in the room apart from myself.,1
Physicists like yourself are a godsend.,1
Max boasted that the queen invited Lucie and himself for a drink.,1
Which pictures of him did Earl see?,1
Which pictures of Earl did he see?,1
Bill seems to himself to be handsome.,1
Bill seems to him to be handsome.,1
John will see which picture of himself?,1
Each other's houses seem to the women to be garish.,1
Each other's houses appear to the women to be garish.,1
These stories about himself worry John more than anything else.,1
Which picture that John took at the party did he decide to display in his house?,1
Which report that John revised did he submit?,1
Mary always prefers lemons to limes.,1
Mary always has preferred lemons to limes.,1
The dog that the rat bit chased the cat.,1
Jean never reads this newspaper.,1
A gun which I had cleaned went off.,1
I gave a gun which I had cleaned to my brother.,1
I gave a gun to my brother which I had cleaned.,1
He let the cats out which were whining.,1
Who did Mary see walking toward the railroad station?,1
Whom did Mary see walking toward the railroad station?,1
Do you know the boy who Mary saw?,1
Do you know the boy whom Mary saw?,1
The government prescribes the height of the lettering on the covers of the reports.,1
Who did he expect to show up who I was acquainted with?,1
Whose book did you find?,1
He will put the chair between some table and some sofa.,1
I know who is mad at John.,1
I know a boy mad at John.,1
John is taller than Dill.,1
John is taller than Bill is.,1
I want to go.,1
Shaving myself is difficult for me.,1
The shock touched off the explosion.,1
The shock touched the explosion off.,1
I called almost all of the men from Boston up.,1
I ran an old man down.,1
He attributed the fire to a short circuit.,1
He attributed to a short circuit the fire which.,1
He threw the letter into the wastebasket.,1
They dismissed the proposal as too costly.,1
They dismissed as too costly the proposal for the State to build a sidewalk from Dartmouth to Smith.,1
I found to be delicious some fruit which I picked up on the way home.,1
I found delicious some fruit which I picked up on my way home.,1
Did the fact that John showed up please you?,1
I want the fact that Bill left to remain a secret.,1
I want it to remain a secret that Bill left.,1
What the thing which I ate cost almost broke me.,1
What the thing cost which I ate almost broke me.,1
I went out with a girl who it pleased that John showed up.,1
I loaned a man who was watching the race my binoculars.,1
She asked a man who was near the window whether it looked like rain.,1
He figured it out.,1
He figured Ann out.,1
He figured something out.,1
He figured the answer out.,1
He figured out the answer.,1
I sent him that.,1
I sent him something.,1
They gave the reports which he had brought with him to me.,1
I insist on seeing all the student' through who started out the term in my class.,1
Tom drives as that man does.,1
Tom drives like that man.,1
I know a man who Tom drives like.,1
Tom drives the way that that man drives.,1
Toms drives the way that that man does.,1
John is taller than that man is.,1
is taller than that man.,1
John is as tall as that man.,1
I know a man who John is as tall as.,1
Mary has never kissed a man who is taller than John is.,1
Mary has never kissed a man who is taller than John.,1
Mary has never kissed a Man taller than John.,1
Mary has never kissed as tall a man as John.,1
The brave are not afraid to die.,1
Drowning cats are hard to rescue.,1
Drowning cats is against the law.,1
I know a taller man than John.,1
The shooting of the prisoners shocked me.,1
He told Peter that I know a taller man than John but Peter didn't believe it.,1
I divulged when Bill promised to call me but I did so reluctantly.,1
I'll talk to John on Friday about the report that the shooting of the prisoners shocked me and to his wife on Saturday.,1
I read a statement which was about that man.,1
I read a statement about that man.,1
The man who I read a statement about is sick.,1
I read that Bill had seen me.,1
Evidence that he was drunk will be presented.,1
Evidence will be presented that he was drunk.,1
That the defendant had been rude was stoutly denied by his lawyer.,1
Bill told me something awful: that ice won't sink.,1
This is a hat which I'm going to see to it that my wife buys.,1
This is a hat which I'm going to see that my wife buys.,1
Phineas knows a girl who is jealous of Maxime.,1
Phineas knows a girl who is behind Maxime.,1
Phineas knows a girl who is working with Maxime.,1
I believed the claim that Otto was wearing this hat.,1
I believed that Otto was wearing this hat.,1
The hat which I believed that Otto was wearing is red.,1
Rutherford understands himself.,1
The man who ordered ice cream said the pudding would be tasty.,1
The pudding which the man who ordered ice cream said would be tasty was a horror show.,1
The man who ordered it said the pudding would be tasty.,1
The sheriff denied that gangsters had bribed him.,1
That gangsters had bribed him was denied by the sheriff.,1
The money which I have hopes that the company will squander amounts to $4000,1
The money which I will have a chance to squander amounts to $4000,1
The money which I will make a proposal for us to squander amounts to $4000,1
The money which I will make a proposal that we squander amounts to $4000,1
I yawned.,1
Sam progressed.,1
Bill gave me $40.,1
I took a snooze.,1
Sam made progress.,1
Bill made a gift to me of $40.,1
Max gave the car a shove.,1
I have a feeling that Arch will show up.,1
Bob proved that this set is recursive.,1
Bob proved this set is recursive.,1
The proof that this set is recursive is difficult.,1
I have hopes the company will squander the money.,1
I have a feeling the company will squander the money.,1
Dick's claim that semantics is generative is preposterous.,1
We are discussing their claim that flying saucers are real.,1
Myron is making the claim that dead is better than red.,1
The man who was arrested by Officer Bob went mad.,1
Jack is claiming that you won't need it.,1
Jack is claiming you won't need it.,1
You're going to hurt yourself one of these days.,1
I spoke to Bill about himself.,1
I know a man who hates me.,1
I read him two statements about himself.,1
I know two men who are behind me.,1
I know two men behind me.,1
You are too flip with people who are jealous of you.,1
I screamed at some children who were watching me.,1
I screamed at some children watching me.,1
Irma washed the dishes and Sally dried and Floyd idled.,1
I went to the store and bought some whisky.,1
I went to the store and Nike bought some whisky.,1
Here's the whisky which I went to the store and bought.,1
Here's the whisky which I went to the store and Mike bought.,1
Tony has a Fiat and yearns for a tall nurse.,1
I went to the store and have bought some excellent whisky.,1
I went to the store to buy some whisky.,1
She's gone and ruined her dress now.,1
I've got to try and find that screw.,1
Aunt Hattie wants you to be nice and kiss your granny.,1
The screw which I've got to try and find holds the door to the frame.,1
Which granny does Aunt Hattie want me to be nice and kiss?,1
The boy works in a skyscraper and the girl in a quonset hut.,1
The luscious chick who Billy went to the movies with will wed me ere the morn.,1
The Ferrari which Pietro who Sofia adores bought from me cost him a bundle.,1
Sally might be pregnant and everyone believes Sheila definitely is pregnant.,1
Sally might be and everyone believes Sheila definitely is pregnant.,1
Tom picked these grapes and I washed these grapes and Suzie will prepare these grapes.,1
Tom picked and I washed and Suzie will prepare these grapes.,1
Students who fail the final exam or who do not do the reading will be executed.,1
Students who fail the final exam will be executed or students who do not do the reading will be executed.,1
John has been captured by the cops and I'm afraid he'll talk.,1
I heated up the coffee and Sally wiped the table off.,1
Although Bob may not be a nut many people have claimed it and I think so too.,1
When did you get back and what did you bring me?,1
Make yourself comfortable.,1
Did Merv show up and did you play chess?,1
Who ate what?,1
What exploded when?,1
Who gave what to whom?,1
How long did this fit of generosity last and who gave what to whom?,1
Please make yourself comfortable and I'll wash the dishes.,1
You please make yourself comfortable and I'll wash the dishes.,1
Harry will be in the Marines next year and Herman was drafted last night.,1
Sasha is gobbling down dumplings faster than I can reheat them.,1
I want to peruse that contract before filing it away.,1
Fred tore the curtain in roiling it up.,1
The curtain which Fred tore in rolling up was the kind gift of my maternal Aunt Priscilla.,1
I want to peruse that contract before damaging it while filing it away.,1
Sasha is gobbling down dumplings faster than I can reheat the meatballs.,1
I want to peruse that contract before filing away the deed.,1
Fred tore the curtain in rolling up the wallpaper.,1
The dumplings which Sasha is gobbling down faster than I can reheat the meatballs are extremely tasty if I do say so.,1
I suspect that the contract which I want to peruse before filing away the deed may some loopholes.,1
The curtain which Fred tore in rolling the wallpaper up was the kind gift of my maternal Aunt Priscilla.,1
The dumplings which Sasha is gobbling down faster than I can reheat them are extremely tasty if I do say so.,1
Reports which the government prescribes the height of the lettering on the covers of are invariably boring.,1
Reports the covers of which the government prescribes the height of the lettering on almost always put me to sleep.,1
Reports the lettering on the covers of which the government prescribes the height of are a shocking waste of public funds.,1
Reports the height of the lettering on the covers of which the government prescribes should be abolished.,1
He has books by several Greek authors.,1
Which Greek authors does he have books by?,1
They will give me a hat which I know that I won't like.,1
The boy whose guardian's employee we elected president betrayed us.,1
I'm going to ask Bill to make the old geezer take up these points later.,1
These points I'm going to ask Bill to make the old geezer take up later.,1
The boy's guardians' employer we elected president.,1
We elected president the boy's guardian's employer.,1
Which boy's guardian's employer did we elect president?.,1
How carelessly have you picked up TNT?,1
Sheila married that tall a man.,1
How tall a man did Sheila marry?,1
On which bed does Tom sleep?,1
The bed on which Tom slept was hard.,1
Which bed did Tom sleep on?,1
The bed which Tom slept on was hard.,1
My sister arrived at a time when no buses were running and my brother arrived at a time when no buses were running too.,1
Jack disappeared in a mysterious manner and the Hudson disappeared in a mysterious manner too.,1
The only relatives who I'd like to do away with are my aunts.,1
That meeting I'd like to sit in on.,1
For whose rights do you expect me to speak up?,1
One plan which I got wind of was calculated to keep us in suspense.,1
Did you notice which difficulties she made.,1
Who are you trying to get hold of?,1
The only offer of which I plan to take advantage will give me an eleven month paid vacation.,1
The scenes to which the censors took objection had to do with the mixed marriage of a woman and a giant panda.,1
Advantage will be taken of his offer.,1
His offer will be taken advantage of.,1
In this experiment fourteen variables must be kept track of simultaneously.,1
Objection was taken to the length of our skirts.,1
A plan to negotiate an honorable end to the war in Vietnam was gotten wind of.,1
Her indiscretions were made light of.,1
Some rare old manuscripts have been gotten hold of.,1
Use was made of Gauss's polynomial lemma.,1
Tabs were kept on all persons entering the station.,1
My friends Mike talked to about politics yesterday.,1
To my friends Mike talked about politics yesterday.,1
I gave to the officer in charge the blackjack. which I had found in the cookie jar.,1
I am confident of and my boss depends on a successful outing at the track.,1
The boy's uncle and aunt were kissing.,1
Who are you gawking at?,1
Which hat do you believe that she never wore?,1
The reporters expected that the principal would fire some teacher.,1
That the principal would fire some teacher was expected by the reporters.,1
The teacher who the reporters expected that the principal would fire is a crusty old jerk.,1
The teacher who it was expected by the reporters that the principal would fire is a crusty old jerk.,1
I disliked the boy's playing the piano loudly.,1
The boy whose loud playing of the piano I disliked was a student.,1
The piano which I disliked the boy's playing loudly was badly out of tune.,1
The boy's loud playing of the piano drove everyone crazy.,1
The boy's playing the piano loudly drove everyone crazy.,1
That piano the boy's loud playing of which drove everyone crazy was badly out of tune.,1
Did his having played the piano surprise you?,1
Mike quipped that she never wore this hat.,1
For Anna to tickle him drives Frank crazy.,1
Anna's tickling him drove Frank crazy.,1
They are investigating all people owning parakeets.,1
It appears to be true that Harry likes girls.,1
This is the dog that chased the cat that caught the rat that ate the cheese.,1
Her efficient looking up of the answer pleased the boss.,1
She did away with her father.,1
It is not true that that Bob was lying was obvious.,1
A proof was given that the claim that John had lied had been made.,1
That Sam didn't pick those packages up which are to be mailed tomorrow is possible.,1
Which packages is it possible that Sam didn't pick up which are to be mailed tomorrow?,1
Sam didn't pick those packages up which are to be mailed tomorrow until it had stopped raining.,1
Sam picked those packages up which are to be mailed tomorrow rest might but he didn't want to do so until it had stopped raining.,1
Which packages which are to be mailed tomorrow is it possible that Sam didn't pick up until it had stopped raining?,1
A girl came in who had worn this coat.,1
That that for Herschel to throw a fit would confuse the guards was obvious is not true.,1
It is not true that that for Herschel to throw a fit would confuse the guards was obvious.,1
It is not true that it was obvious that for Herschel to throw a fit would confuse the guards.,1
That that it would confuse the guards for Herschel to throw a fit was obvious is not true.,1
It is not true that that it would confuse the guards for Herschel to throw a fit was obvious.,1
That it was obvious that it would confuse the guards for Herschel to throw a fit is not true.,1
It is not true that it was obvious that it would confuse the guards for Herschel to throw a fit.,1
A review of this article came out yesterday.,1
A review came out yesterday of this article.,1
A review seems to have come out yesterday of this article.,1
Why don't you pick some review up of this article?,1
Ann is going to send a picture of Chairman Mao to her teacher as soon as she gets home.,1
Ann is going to send a picture to her teacher of Chairman Mao as soon as she gets home.,1
That a review came out yesterday of this article is catastrophic.,1
I'll give some to my good friend from Akron.,1
Around midnight I promised that he would be there.,1
I promised that he would be there tomorrow.,1
Tomorrow I promised chat he would be there.,1
I promised that tomorrow he would be there.,1
I promised that around midnight he would be there.,1
Beans I don't like.,1
Proud of him I've never been.,1
Beans I don't think you'll be able to convince me Harry has ever tasted in his life.,1
It was tomorrow that I promised that he would be there.,1
It is beans that I don't like.,1
Do you think that he sometimes went there alone?,1
I won't ask you to believe that he tried to force me to give her some money.,1
That he sometimes went there alone is certain.,1
Do you believe that somebody was looking for something?,1
I never met that man who somebody tried to kill.,1
I won't have any money.,1
Do you think that he ever went there alone?,1
That he ever went there alone is odd.,1
Tom told somebody that he wasn't sick.,1
Buffy couldn't do 00 push ups and somebody laughed.,1
I believe that the sun was out.,1
I believed that the sun was out.,1
I believed that the sun is out.,1
That I believed that the sun was out is obvious.,1
That I believed that the sun is out is obvious.,1
That Jack sometimes slept is impossible.,1
That Jack ever slept is impossible.,1
That the sun was out was obvious.,1
John scratched his arm and Mary did too.,1
Mary scratched her arm too.,1
Mary scratched John's arm too.,1
John scratched his arm and the boy who knew Mary scratched her arm.,1
John scratched his arm and the boy who Mary knew did so too.,1
That the fuzz wanted him worried John but it didn't worry Mary.,1
That the fuzz wanted him worried John but that the fuzz wanted John didn't worry Mary.,1
That the police wanted him worried Johns but it didn't worry the boy who Mary knew.,1
John is prouder of having gone than people who don't know him would expect me to believe he would be.,1
John is prouder of having gone than Sally expected Joan to believe that the man who didn't shave would be.,1
John is prouder of having gone than I expected you to believe he would be of not having fallen asleep.,1
Tom knows it and Dick knows it and Harry knows it.,1
Tom washed the car and Dick waxed the car.,1
Tom ordered bacon and Dick ordered lettuce and Harry ordered tomatoes.,1
Tom Dick and Harry know it.,1
