But Mr. Buckley seems to have assumed he would be given the right to pick Mr. Gerosa's successor .,1
Screvane and Beame hailed,1
"The Mayor declined in two interviews with reporters yesterday to confirm or deny the reports that he had decided to run and wanted Mr. Screvane , who lives in Queens , to replace Abe Stark , the incumbent , as the candidate for President of the City Council and Mr. Beame , who lives in Brooklyn , to replace Mr. Gerosa as the candidate for Controller .",1
The Mayor spoke yesterday at the United Irish Counties Feis on the Hunter College Campus in the Bronx .,1
"After his speech , reporters asked him about the report of his political intentions , published in yesterday's New York Times .",1
`` It didn't come from me .,1
"But as I have said before , if I announce my candidacy , I will have something definite to say about running mates '' .",1
There is a tangible feeling in the air of revulsion toward politics .,1
The taxi driver taking the visitor from the airport remarks that politicians in the state are `` all the same '' .,1
"`` It's ' See Joe , see Jim ' '' , he says .",1
`` The hand is out '' .,1
"A political scientist writes of the growth of `` alienated voters '' , who `` believe that voting is useless because politicians or those who influence politicians are corrupt , selfish and beyond popular control .",1
"These voters view the political process as a secret conspiracy , the object of which is to plunder them '' .",1
"Corruption is hardly a recent development in the city and state that were widely identified as the locale of Edwin O'Connor's novel , `` The Last Hurrah '' .",1
But there are reasons for the current spotlight on the subject .,1
A succession of highly publicized scandals has aroused the public within the last year .,1
Graft in the construction of highways and other public works has brought on state and Federal investigations .,1
And the election of President Kennedy has attracted new attention to the ethical climate of his home state .,1
"A reader of the Boston newspapers can hardly escape the impression that petty chicanery , or worse , is the norm in Massachusetts public life .",1
Day after day some new episode is reported .,1
"The state Public Works Department is accused of having spent $8,555 to build a private beach for a state judge on his waterfront property .",1
An assistant attorney general is directed to investigate .,1
Washington ,1
There are a number of ways this could happen ,1
When he protested ,1
And then ,1
"Indonesia is one of the twenty under-developed countries of Asia , Africa and Latin America that are receiving Soviet aid .",1
"The Soviet Union and other members of the Communist bloc are rapidly expanding their economic , technical and military assistance to the uncommitted nations .",1
"The Communist countries allocated more than $1,000,000,000 in economic aid alone last year , according to Western estimates .",1
This was the biggest annual outlay since the Communist program for the under-developed countries made its modest beginning in 1954 .,1
"In 1960 more than 6,000 Communist technicians were present in those countries .",1
-- A committee of experts has recommended that a country's population be considered in the distribution of professional posts at the United Nations .,1
This was disclosed today by a responsible source amid intensified efforts by the Soviet Union to gain a greater role in the staff and operation of the United Nations .,1
"One effect of the proposal , which puts a premium on population instead of economic strength , as in the past , would be to take jobs from European nations and give more to such countries as India .",1
"India is the most populous United Nations member with more than 400,000,000 inhabitants .",1
The new formula for filling staff positions in the Secretariat is one of a number of recommendations made by a panel of eight in a long and detailed report .,1
The report was completed after nearly eighteen months of work on the question of the organization of the United Nations .,1
Formula is due this week,1
The Advisory Committee on Administrative and Budgetary Questions is expected to receive the report this week .,1
The jobs formula is understood to follow these lines :,1
"Each of the organization's ninety-nine members would get two professional posts , such as political affairs officer , a department head or an economist , to start .",1
"Each member would get one post for each 10,000,000 people in its population up to 150,000,000 people or a maximum of fifteen posts .",1
"Each member with a population above 150,000,000 would get one additional post for each additional 30,000,000 people up to an unspecified cut-off point .",1
The decision was made in Zurich by Prince Boun Oum ,1
The latter two are half-brothers .,1
Their joint statement was welcomed by the Western delegations who will attend tomorrow the nineteenth plenary session of the fourteen-nation conference on the future of Laos .,1
"An agreement among the Princes on a coalition government would ease their task , diplomats conceded .",1
But no one was overly optimistic .,1
Tactics studied in Geneva,1
"W. Averell Harriman of the United States , Malcolm MacDonald of Britain , Maurice Couve De Murville , France's Foreign Minister , and Howard C. Green , Canada's Minister of External Affairs , concluded , meanwhile , a round of consultations here on future tactics in the conference .",1
The pace of the talks has slowed with each passing week .,1
"Princess Moune , Prince Souvanna Phouma's young daughter , read the Princes' statement .",1
"They had a two-hour luncheon together in `` an atmosphere of cordial understanding and relaxation '' , she said .",1
"The three Laotians agreed upon a six-point agenda for their talks , which are to last three days .",1
The Princess said it was too early to say what would be decided if no agreement was reached after three days .,1
To deal with principles,1
"The meetings in Zurich , the statement said , would deal only with principles that would guide the three factors in their search for a coalition Government .",1
"Appointment of William S. Pfaff Jr. , 41 , as promotion manager of The Times-Picayune Publishing Company was announced Saturday by John F. Tims , president of the company .",1
"Pfaff succeeds Martin Burke , who resigned .",1
"The new promotion manager has been employed by the company since January , 1946 , as a commercial artist in the advertising department .",1
"He is a native of New Orleans and attended Allen Elementary school , Fortier High school and Soule business college .",1
"From June , 1942 , until December , 1945 , Pfaff served in the Army Air Corps .",1
"While in the service he attended radio school at Scott Field in Belleville , Ill. .",1
"Before entering the service , Pfaff for five years did clerical work with a general merchandising and wholesale firm in New Orleans .",1
"He is married to the former Audrey Knecht and has a daughter , Karol , 13 .",1
They reside at 4911 Miles Dr. .,1
Washington,1
-- Thousands of bleacher-type seats are being erected along Pennsylvania Avenue between the Capitol and the White House for the big inaugural parade on Jan. 20 .,1
"Assuming the weather is halfway decent that day , hundreds of thousands of persons will mass along this thoroughfare as President John F. Kennedy and retiring President Dwight D. Eisenhower leave Capitol Hill following the oath-taking ceremonies and ride down this historic ceremonial route .",1
"Pennsylvania Avenue , named for one of the original 13 states , perhaps is not the most impressive street in the District of Columbia from a commercial standpoint .",1
But from a historic viewpoint none can approach it .,1
Many buildings,1
"Within view of the avenue are some of the United States government's tremendous buildings , plus shrines and monuments .",1
"Of course , 1600 Pennsylvania , the White House , is the most famous address of the free world .",1
"Within an easy walk from Capitol Hill where Pennsylvania Avenue comes together with Constitution Avenue , begins a series of great federal buildings , some a block long and all about seven-stories high .",1
"Great chapters of history have been recorded along the avenue , now about 169 years old .",1
In the early spring of 1913 a few hundred thousand persons turned out to watch 5000 women parade .,1
They were the suffragettes and they wanted to vote .,1
In the 1920 presidential election they had that right and many of them did vote for the first time .,1
Seats on square,1
Along this avenue which saw marching soldiers from the War Between the States returning in 1865 is the National Archives building where hundreds of thousands of this country's most valuable records are kept .,1
Also the department of justice building is located where J. Edgar Hoover presides over the federal bureau of investigation .,1
"Street car tracks run down the center of Pennsylvania , powered with lines that are underground .",1
"Many spectators will be occupying seats and vantage points bordering Lafayette Square , opposite the White House .",1
"In this historic square are several statues , but the one that stands out over the others is that of Gen. Andrew Jackson , hero of the Battle of New Orleans .",1
Moving past the presidential viewing stand and Lafayette Square will be at least 40 marching units .,1
"About 16,000 military members of all branches of the armed forces will take part in the parade .",1
Division one of the parade will be the service academies .,1
"Division two will include the representations of Massachusetts and Texas , the respective states of the President and of Vice-President L. B. Johnson .",1
Then will come nine other states in the order of their admission to the union .,1
Division three will be headed by the Marines followed by 12 states ; ;,1
division four will be headed by the Navy ,1
Wagner replied ,1
The third belief ,1
"The outlook for the amateur , for instance , is usually dependent on his fondness for local history or for the picturesque .",1
"His love of folklore has romanticism in it , and he doesn't care much about the dollar-sign or the footnote .",1
"Folklore is his hobby , and he , all too rightly , wishes it to remain as such .",1
"The amateur is closely related to the collector , who is actually no more than the amateur who has taken to the field .",1
The collector enjoys the contact with rural life ; ;,1
he hunts folklore for the very `` field and stream '' reasons that many persons hunt game ; ;,1
and only rarely is he acutely concerned with the meaning of what he has located .,1
"Fundamentally , both these types , the amateur and the collector , are uncritical and many of them don't distinguish well between real folklore and bogus material .",1
"But there are also the commercial propagandists and the analysts -- one dominated by money , the other by nineteenth-century German scholarship .",1
Both are primarily concerned with the uses that can be made of the material that the collector has found .,1
Both shudder at the thought of proceeding too far beyond the sewage system and the electric light lines .,1
"The commercial propagandist , who can't afford to be critical , gets along well with the amateur , from whom he feeds , but he frequently steps on the analyst's toes by refusing to keep his material genuine .",1
"His standards are , of course , completely foreign to those of the analyst .",1
"To both the amateur and the commercial progandist the analyst lacks a soul , lacks appreciation with his endless probings and classifications .",1
"Dominated by the vicious circle of the university promotion system , the analyst looks down on and gets along poorly with the other three groups , although he cannot deny his debt to the collector .",1
The knowledge that most Americans have of folklore comes through contact with commercial propagandists and a few energetic amateurs and collectors .,1
"The work done by the analysts , the men who really know what folklore is all about , has no more appeal than any other work of a truly scientific sort and reaches a limited , learned audience .",1
"Publishers want books that will sell , recording studios want discs that will not seem strange to ears used to hillbilly and jazz music , grade and high schools want quaint , but moral , material .",1
The analyst is apt to be too honest to fit in .,1
As a result of that something wrong happened.,1
The influence of Mass was less pervasive than that of the congested ,1
O'Banion's first conflict with the police came in 1909 ,1
These booze customers had until then been buying their supplies from the Sheldon ,1
She whirled and faced him ,1
the bringing together around it of the secret liaison between indolent ,1
Life is further characterized ,1
The slaves never shared in their profits ,1
"The Charles Men consists not of a connected narrative but of a group of short stories , each depicting a special phase of the general subject .",1
"Somewhat uneven in interest for an average reader , eight or ten of these are among the finest of their kind in literature .",1
"They comprise a great variety of scene and interest : grim episodes of war , idyllic interludes , superb canvases of world-shaking events , and delightfully humorous sketches of odd characters .",1
The general effect is tragic .,1
"Almost nothing is said of Charles' spectacular victories , the central theme being the heroic loyalty of the Swedish people to their idolized king in misfortune and defeat .",1
To carry out this exalted conception the author has combined the vivid realism and imaginative power we have noticed in his early poetry and carried them out on a grand scale .,1
"His peculiar gift , as had been suggested before , is his intensity .",1
George Meredith has said that fervor is the core of style .,1
Of few authors is this more true than of Heidenstam .,1
"The Charles Men has a tremendous range of characters , of common folk even more than of major figures .",1
"The career of Charles 12 , is obviously very similar to that of Napoleon .",1
"His ideal was Alexander of Macedon , as Napoleon's was Julius Caesar .",1
"His purpose , however , was not to establish an empire , but to assert the principle of divine justice .",1
"Each aspired to be a god in human form , but with each it was a different kind of god .",1
Each failed catastrophically in an invasion of Russia and each brought ruin on the country that worshipped him .,1
Each is still glorified as a national hero .,1
"The first half of The Charles Men , ending on the climax of the battle of Poltava in 1709 , is more dramatically coherent than the second .",1
After the collapse of that desperate and ill-fated campaign the character of the king degenerated for a time into a futility that was not merely pitiable but often ridiculous .,1
"Like Napoleon , he was the worst of losers .",1
"There are , however , some wonderful chapters at the beginning of the second part , concerning the reactions of the Swedes in adversity .",1
Then more than ever before did they show their fortitude and patient cheerfulness .,1
"This comes out in `` When The Bells Ring '' , which describes the rallying of the peasants in southern Sweden to repel an invasion by the Danes .",1
"In `` The King's Ride '' , Charles breaks out of a long period of petulance and inertia , regains his old self , escapes from Turkey , and finally reaches his own land after an absence of eighteen years .",1
He finds it in utter misery and desolation .,1
All his people ask for is no more war .,1
"But he plunges into yet another , this time with Norway , and is killed in an assault on the fortress of Fredrikshall , being only thirty-six years of age when he died .",1
He had become king at fifteen .,1
Then suddenly there was a tremendous revulsion of popular feeling .,1
From being a hated tyrant and madman he was now the symbol of all that was noblest and best in the history of Sweden .,1
"This is brought out in the next to last chapter of the book , `` A Hero's Funeral '' , written in the form of an impassioned prose poem .",1
"Slowly the procession of warriors and statesmen passes through the snow beside the black water and into the brilliantly lighted cathedral , the shrine of so many precious memories .",1
"The guns are fired , the hymns are sung , and the body of Charles is carried down to the vault and laid beside the tombs of his ancestors .",1
"As he had longed to be , he became the echo of a saga .",1
Heidenstam wrote four other works of fiction about earlier figures revered in Swedish memory .,1
"Excellent in their way , they lack the wide appeal of The Charles Men , and need not detain us here .",1
"It is different with his volume The Swedes And Their Chieftains ( Svenskarna och deras Hovdingar ) , a history intended for the general reader and particularly suited for high school students .",1
"Admirably written , it is a perfect introduction to Swedish history for readers of other countries .",1
"Some of the earlier episodes have touches of the supernatural , as suited to the legendary background .",1
These are suggestive of Selma Lagerlof .,1
"Especially touching is the chapter , `` The Little Sister '' , about a king's daughter who became a nun in the convent of St. Birgitta .",1
The record teems with romance and adventure .,1
"Gustaf Vasa is a superb example , and Charles 10 , , the conqueror of Denmark , hardly less so .",1
"Of Gustavus Adolphus and Charles 12 , it is unnecessary to speak .",1
"Today the private detective will also investigate insurance claims or handle divorce cases , but his primary function remains what it has always been , to assist those who have money in their unending struggle with those who have not .",1
It is from this unpromising background that the fictional private detective was recruited .,1
The mythological private eye differs from his counterpart in real life in two essential ways .,1
"On the one hand , he does not work for a large agency , but is almost always self-employed .",1
Everyone needs to bring their pencil. ,0
Because I wanted to go on a picnic. ,0
When I gets here. ,0
"Lisa went to the concert, she saw the band.",0
"Smelling like rotten fish, my sister took the trash out. ",0
"Watching from the airplane window, the volcano erupted.",0
Does the car need its oil changed? ,0
Their goes my freedom. ,0
There going to bring theyre suitcases. ,0
Your going to need youre notebook.,0
Would you like to take part of this activity?,0
 She was bathing,0
 She knew French for Tom.,0
 John is tall on several occasions.,0
 The ship sank,0
 They noticed the painting,0
 John was tall,0
 I know that Meg's attracted to Harry,0
 Since Jill said Joe had invited Sue,0
 She said she had spoken to everybody,0
 Each of the performers came in,0
 She doesn't meet anyone for dinner,0
 John likes some students,0
 Joan said she talked to the students,0
 He announced he had eaten the asparagus,0
 She said she talked to three students but I don't know how many.,0
 She said she talked to those students but I don't know how many.,0
 Sandy was trying to work out which students would be able to solve a certain problem,0
 John and someone were dancing together,0
 It has been determined that somebody will be appointed; it's just not clear yet who.,0
 Sally asked if somebody was going to fail math class,0
 The TA's have been arguing about whether some student or other should pass,0
 In which way is Sandy very anxious to see if the students will be able to solve the homework problem?,0
 In which way is Clinton anxious to find out which budget dilemmas Panetta would be willing to solve?,0
 What did you leave before they did?,0
 What did you leave before they started playing?,0
 Agnes wondered how John could eat but it's not clear what.,0
 Tony sent Mo a picture that he painted,0
 Who did they see someone?,0
 The book was by John written.,0
 The argument was summed by the coach up.,0
 The paper was written by John up.,0
 John was spoken by Mary to.,0
 John was seen the book.,0
 John was spoke by Mary to.,0
 The table was wiped by John clean.,0
 Mary was given by John the book.,0
 The magazines were sent to herself by Mary.,0
 Chocolate eggs were hidden from each other by the children.,0
 Books were taken from no student and given to Mary by any professor.,0
 Books were taken from each student and given to Mary by the other.,0
 Bill ate the peaches,0
 Bill ate the peaches and Harry did the grapes.,0
 Tom will smoke the grass,0
 Max seemed to be trying to force Ted to leave the room,0
 Maytag will give a brand-new dryer to the winner of the Mrs.,0
 Bill didn't eat the peaches,0
 Bill must quickly eat the peaches,0
 Gould's performance of Bach on the piano doesn't please me anywhere as much as Ross's on the harpsichord.,0
 Tom's dog with one eye attacked Frank's with three legs.,0
 Because Steve's of a spider's eye had been stolen,0
 The book what inspired them was very long.,0
 I want goes to the store.,0
 I wonder what to be a clown on the cover of.,0
 Bother you that Kim left!,0
 A student who to talk to us just walked in.,0
 It was to to amuse us that Kim was singing that they wanted.,0
 What they feared most was to be no one available to help them.,0
 We tried to amuse them that Kim was singing.,0
 I wonder in whom them to place their trust.,0
 I wonder whom us to trust.,0
 I wonder who for us to trust.,0
 I dislike the people in who we placed our trust.,0
 A letter was received Jones would be upset by.,0
 The only person whose kids Dana is willing to put up with was written by John.,0
 The book that I like - everyone else in the class hates.,0
 Which boy's mother did you meet who you liked?,0
 Which book's author did you meet who you liked?,0
 Who for Sandy to talk to is still enrolled in the class?,0
 Leslie likes ourselves.,0
 Ourselves like ourselves.,0
 We gave us presents.,0
 We gave us to the cause.,0
 Leslie told us about us.,0
 Leslie told ourselves about us.,0
 We think that Leslie likes ourselves.,0
They drank the pub.,0
The professor talked us.,0
We yelled ourselves.,0
We yelled Harry hoarse.,0
Harry coughed himself.,0
Harry coughed us into a fit.,0
They caused him to become angry by making him.,0
They caused him to become president by making him.,0
They made him to exhaustion.,0
The car honked down the road.,0
The dog barked out of the room.,0
The witch went into the forest by vanishing.,0
The building is tall and tall.,0
This building is taller and taller.,0
This building got than that one.,0
This building is than that one.,0
?Bill floated into the cave for hours.,0
?Bill pushed Harry off the sofa for hours.,0
Bill cried Sue to sleep.,0
The elevator rumbled itself to the ground.,0
She yelled hoarse.,0
Ted cried to sleep.,0
The ball wriggled itself loose.,0
The most you want the least you eat.,0
I demand that the more John eat the more he pay.,0
I demand that John pays more the more he eat.,0
You get angrier the more we eat don't we.,0
The harder it has rained how much faster a flow that appears in the river?,0
The harder it rains how much faster that do you run?,0
The harder it rains how much faster a flow that do you see in the river?,0
As it rains harder how much faster a flow that appears in the river?,0
When it rains harder how much faster a flow that appears in the river?,0
The more John eats the tighter keep your mouth shut about it.,0
The more everyone eat the more John keeps his big mouth shut about it OK?,0
0??I can well imagine the more him eating the fatter him getting.,0
Bill can well imagine the more he eats the fatter getting.,0
It is important the more you eat the more careful to be.,0
It is important for the more you eat the more careful to be.,0
It is important the more you to eat the more careful to be.,0
It is important the more you eat the more careful you to be.,0
It is important the more you eat the more careful for you to be.,0
It is important for the more you to eat the more careful to be.,0
It is important for the more you to eat the more careful for you to be.,0
It is important the more you to eat the more careful for you to be.,0
It is important for the more you eat the more careful you to be.,0
I can well imagine quickly Mary answering the question.,0
0?*I can well imagine with a hatchet Mary destroying the Jeep.,0
0?*I can well imagine if he eats more him getting fat.,0
It is not entirely obvious if Mary listens to the Grateful Dead she gets depressed.,0
It is not entirely obvious whether Mary listens to the Grateful Dead she gets depressed.,0
The more pictures Mary looked at she got angrier and angrier.,0
His expectations lower the higher the stakes.,0
His expectations lower the higher the stakes are.,0
The more obnoxious Fred the less attention you should pay to him.,0
The more obnoxious Fred the less you should pay attention to him.,0
I don't plan to lock the door no matter how fancy this hotel.,0
I'm going out wherever that hurricane.,0
The more food Mary knows a man that eats the poorer she gets.,0
The fatter he goes to a doctor when he gets the more he eats.,0
The fatter that that he gets bothers him the more he eats.,0
The more books I ask to whom he will give the more he reads.,0
The more people I ask what he will give to the more he reads.,0
The more carefully he knows a man that worded the letter the safer he'll be.,0
The more John meets geniuses the angrier he gets.,0
The more people you say that will buy tickets the happier I'll be.,0
The more he eats the poorer he knows a woman that gets.,0
The more he eats the fatter he goes to a doctor when he gets.,0
The more he eats the fatter that that he gets really bothers me.,0
